comment,leaning
">Well we have a tested system which is tantamount to crimes against humanityAre you kidding me? Do you know how much money the US spends on R&D? There is no country that comes even close. Not ANYWHERE close. Not even in the same ballpark. Not even in the same galaxy. China is second with 1/4 and the vast majority of their publications are literally copy/paste of American documentation. THAT is what you call a ""crime against humanity""? What in the fuck. Seriously I'm at a loss of words on how you could type something that is so false and disgustingly hyperbolic just to push your political agenda. Absolutely disgusting and you should feel bad.>Grow up and learn that life is unfairHow about you grow up and learn people don't work for free. People bring their talents to where they will get the most money for those talents. For many that's becoming a lawyer a doctor researcher etc. For someone who defends Technocracy you sure seem oblivious to the fact these people don't do this for free. You think people go into engineering because they don't get payed anything? Seriously. And you're telling me to grow up? Completely laughable. >and private interests hate youThey don't hate you they just don't care about you unless you can contribute and by the looks of your posting history not only do you not contribute you'd seem like you'd be a person who does nothing but complain about everything at every turn possible.>All you 12-year-olds imposing your views on us is annoying.Rich coming from someone who attempts to spew insults about peoples moms on the same level as your average 12 year old XBox gamer.>It's pretty easy stuff...Obviously. ",
A lot of people believe that our tax system/annual budget can be reorganized to take in the same amount or slightly less with a single payer bill as part of the equation. Thus not increasing the tax burden on anyone and still offering single payer otherwise it's a perception that the government is just increasing its bloat. It's not that it is not logical its more that if they are going to pass something like this they need to be responsible about it instead of just increasing the burden on the tax payers. $1200 a month is a lot and reducing that to 600 is important but most people do not view paying the government as the same thing as paying a private company for insurance. They also do not think the government can truly handle the burden of operating such a monolithic system and their tax dollars will go to waste instead of actually to the care system they are paying for. ,
"Honestly I don't even think it's the messenger that matters here. It's one of the reasons I never was that upset hillary didn't back single payer... because it's more about time. It's just gonna take time for the core goodness of the idea to filter through the population - like gay marriage. There was no one person who led the fight to legalizing gay marriage it was just this slow tide of more and more people realizing the undenialble truth of ""oh wait there's nothing wrong with gay people getting married"" and the same will happen here... more and more people will just realize ""oh wait ensuring everyone has healthcare is a good idea""",
>Exactly why does Reddit fawn over this guy? On top of being a literal fucking communist two decades ago he also did a whole lot of shady shit during the primary and afterward. I won't fault him for being a communist or being a socialist because as a millenial those words aren't toxic to me... BUT... I will fault him and his supporters for not accepting the reality that his socialism communism *would* have impacted him significantly in the general among older voters and older voters decide elections because young voters *don't show up.* As for the shady shit as for his dividing the party and staying in the race even though he was pretty much mathematically eliminated in *march.* And even as it was obvious the damage he would do in the general...  I don't get why they love him. He's half the man Hillary Clinton ever was and Hillary Clinton isn't even a man that's how much smarter and more accomplished she is.,
You remember? That mentality has never left and if that's something you experienced then I'm sorry for you. I don't think you took into consideration of how big of a loss it is to miss out on 8-10 years of job experience. While I'm in school still continuing my education the person who is already in the workforce has had numerous pay increases and promotions and is likely to be making just as much or even more than a physician. The wealthy are the minority who decide to go into private practice. Your not seeing that type of money working in a clinic or hospital. Again the path to medicine is long and rigorous. Every MD I know loves what they do salary the payoff for all the hard work.,
DAE like my RE(SIST)DDIT UserNaMe: CoMMaNdEr_In_ThIeF??? haha XD took Me a wHile to Cum up wit it but worth it ^_^       wE r ThE rEsIStANcE. FeAr Us. We DoNoT FoRgIve. We Do NoT ForGeT.      #RESIST #IMWITHHER #DRUMPF #MUHRUSSIA          wOW join teh revolution guize. We r important. Antifa rulez lets Save AMERIKKKA. i May ONly be 19 BUT I know EVERYTHING i ned 2 learn thx 2 going 2 BERKLEY. #FEMINISM      TRUMP _ÙÔè IS _ÙÔè GOING _ÙÔè TO _ÙÔè BE _ÙÔè PRESIDENT _ÙÔè FOR _ÙÔè 3 _ÙÔè MORE _ÙÔè YEARS. DEAL. WITH. IT. Keep it up losers and we'll make it 7. ,
"That won't happen.  We have broader coverage requirements without the same cutoffs.  In the US doctors are not allowed to overrule patient and family wishes in the context of medical futility.  Your 82 year old demented grandma is in renal failure because she can't remember to eat?  In the US we'd place a port and start hemodialysis (if the family desires).  In the U.K./France/Germany?  Hospice no matter what the family wants.  Look at the recent situation in UK with  Charlie Gard:  his parents wanted to keep him alive despite medical futility (i.e. Tracheostomy PEG tube and life on a ventilator). The courts said no and forced a withdrawal of care on a child despite the parents wishes.   That will never happen here (Americans can't be told no when it comes to healthcare; their unalienable ""right"" to it and all).  If universal healthcare in the form of unlimited Medicaid for all happens it will bankrupt this country. ",
That exactly the kind of thinking that killed millions in Russia. The farmers were great at producing food so naturally they became rich. The useless leeches of society felt this was unfair so they killed the successful farmers and took their land. Since they were useless they produced no food and millions starved. Those who didn't starve went hungry and suffered from malnutrition everyday waiting in bread lines. You have to remember a rich person got rich by giving something to the masses that they wanted. You kill all the givers and next thing you know there'll be nothing for you to take.If you don't learn from history you're bound to repeat it and most likely starve thanks to your own ignorance. Just say no kiddo.,
"Right. Except single-payor overlooks the most important factor and it's PRICING. There is very little stake in responsibility when the claims just get paid by the government. In which case you don't have behemoths like Cigna and BlueCross reviewing claims before paying them. So you might propose a fee schedule. Sure. Have you ever tried negotiating a surgery?  You cannot just call up a doctor and say ""You're getting paid this much"" and expect them to take it. I was a huge Bernie supporter and single-payor supporter but after having worked almost two years now doing claims integrity it makes me wince thinking how much fraud and abuse would increase if we instated single-payor. Moreover it won't happen because Cigna BlueCross Humana etc. won't let it happen. They own all the influence and have more money than God to throw at whatever they want. What we need is PRICING and INTEGRITY way before ever thinking of even trying single-payor. ALSO the reason you stop paying into SS at a certain point is to force people to diversify investments so that their entire retirement isn't sitting with the government. It's a very logical process. And that money goes back to the person who pays into it not public funds. ",
"Looking at the tax increase other countries pay (as it contributes to healthcare) I would happily take this over paying premiums.  There's so many reasons why.1) Most importantly it allows people to have freedom of where they work.  Unless you are really well off you know someone who works a job they hate because it has benefits they need/want.  If you no longer MUST be employed to get healthcare it's a huge swing in power.  England I believe (please correct me if I have misresearched this next statement) you can have healthcare offered by your employer that is on top of the care.  This coverage allows you more coverage or ""skip places in line"" that kind of stuff.  2) Lower cost for providers.  Having to figure out the ICD-9 code that BCBS will take over UHC requires encyclopedic knowledge of the working of the system.   Instead the doctor can simply bill one code and the provider will accept it.3) Lower cost to the average user.  Yes you will have higher taxes.  But you are no longer paying that large monthly premium.  I pay thousands a year in premiums for my family.   Taxed based on research of what other countries pay is lower than that.  Heck even if it was the exact same point 1 still holds. ",
"I wonder how different it will be from his campaign plan. Keep in mind this is part of a more comprehensive tax plan rather than just a healthcare bill:>""We will raise taxes‰Ûù the Vermont Senator told a crowd at the CNN Democratic town hall this week. ""Yes we will.""Sanders who is neck-and-neck with Hillary Clinton in Iowa and leading New Hampshire has proposed an array of ambitious new government programs from free college tuition and paid family leave to universal health care and recently dropped a new tax plan explaining how he'd pay for it all.>""It's a very very very big tax increase for everyone except those at the bottom"" Roberton Williams a fellow at the Urban-Brookings Tax Policy Center told TIME.>In an analysis released today the Tax Foundation an independent tax policy research organization found that Sanders' plan would lead to 10.56% lower after-tax income for all taxpayers and a 17.91% lower after-tax income for the wealthiest Americans. When accounting for reduced GDP taxpayers would see their after-tax incomes fall by 12.84% on average the report said.Williams was more cautionary. ""There are also a lot of moving pieces"" he explained. ""It's a big tax increase but there are all these goodies on the other end. So there will be winners and losers."">Take for example Sanders' plan to provide universal single-payer healthcare. Sanders says he'd pay for that with a new 2.2% income-based ""health care premium"" tax as well as a 6.2% payroll tax paid for by employers. That adds up to a big increase‰ÛÓbut it also means that in exchange Americans would save the thousands of dollars they spend every year on premiums deductibles and other out-of-pocket health care costs.>The typical American family of four covered by an employer-sponsored health care plan paid $24671 last year on health care costs alone according to the non-partisan Milliman Medical Index.""The savings that Americans would gain by the elimination of private insurance premiums and deductibles are much greater than the public insurance premiums they would pay under Bernie‰Ûªs plan"" Warren Gunnels Sanders' policy director told TIME.http://time.com/4194179/bernie-sanders-tax-plan/",
This must also be accompanied by the reduction of healthcare provisions in other forms of insurance.  The costs of Property and auto insurance should reduce since the personal injury is no longer part of it.It would be a larger reach but the amount my employer says they pays for my healthcare should also be in consideration.  Since Medicare is infinitely lower cost a percentage should be moved into that tax and the balance should be added to my paycheck.The average uneducated viewer sees higher taxes but does not understand this should be a net gain to the average American.,
The startup I was working for sold to a huge corporation.  My monthly insurance costs dropped by about 80% from our shitty small company group plan we had been on.  When I compare employer contribution plus what I was paying vs now the big company has a much better deal.  Their group plan spreads the risk across tens of thousands and ours was tens of participants.  It is quite frustrating.  I have the same health now as I did then my use of health care services is the same. I'm doing the same work.  Yet I'm paying  different prices and access to the system because of my employer.  ,
Part of the problem is that they don't make those problems to themselves which kind of betrays their own supposed principles. If and when conservatives are in favor of something that I see will help my principles I will accept that as a good point for that thing and actively acknowledge it. I acknowledge that there seems to be better evidence that market based systems are very useful in providing certain things more efficiently. My sympathies lie entirely with communists people who want things to be selected more democratically. But I am willing to work in the apparent usefulness of market systems into my ideology because my ultimate ideology is to maximise the average utility of the whole social order and in doing so help maximise my own utility. But conservatives only adhere to social utility when convenient asserting a quaint fantasy that will achieve it which just so happens to take the form of corporatocracy when enacted. And that fantasy can be shown for the smokescreen that it is when liberals put forward something to actually appease it and they reject it. If conservatives actually believed in entrepreneurship they would enact universal healthcare to help entrepreneurs. The reason they don't is because they don't. They only care about appeasing the already powerful.,
"The savings will be statistical. Most will be better off. Some will be much better off. A few will be worse off. The problem is the republicans are the party of the anecdote. They will find some person that is paying more and that will be the next ""Joe the plumber"" figure that gets trotted out as an example of the government screwing people. The savings are also hidden in taxes. So your tax bill is higher but your not paying insurance premium directly. Also your tax bill is higher for your whole life while your insurance premiums start low and get higher with age. Many people will see higher taxes and not understand that on average over your life this is much cheaper than the old way. It's a hard sell and the difficulty is compounded by the fact that one party has no intention of making this a fact based intelligent discussion. ",
> on average the total premiums paid between you and your employer is $17K or more for a family plan.I hope people are not so naive as to think everyone that has health insurance through work now will get a raise equal to what their employer was formerly paying towards their insurance.  More like you and your employer paid a total of $17k now the employer gets $8500/employee extra and the health insurance tax of $13k means you get to make up the difference over and above your $8500 you are paying in health insurance tax rather than to Blue Cross or whoever any more so there's an extra $375 a month gone from your check. ,
>Republicans voted more than 60 times to repeal and replace Obamacare while Obama was still in office. They knew they wouldn't get their wish but by actively campaigning and voting for it (over and over again) they convinced the American public (Republicans anyway) that it was an important issue that needed to be a focus of future elections.I really wish Clinton and her supporters understood this is how incrimentalism actually works.  It's what the GOPs been doing for decades and they've incrimented us to a racist Nazi sympathizing POTUS.  You keep pushing the window while locking in your gains via compromise not negotiate with yourself before you even sit at the table.  Her methods let the GOP keep pushing us right. ,
> Republicans voted more than 60 times to repeal and replace Obamacare while Obama was still in office. They knew they wouldn't get their wish but by actively campaigning and voting for it (over and over again) they convinced the American public (Republicans anyway) that it was an important issue that needed to be a focus of future elections.And now they can't repeal or replace the ACA because they never developed a workable plan beyond campaign slogans.  Democrats should be wary of falling into the same trap.  This is a great start but they need to refine the policy and the messaging.  Far too many people seem to believe that single payer is inevitable because it's the best policy and it's popular. But there is no real workable policy yet and it will be extremely difficult to maintain public support once the attacks begin.,
It'd be interesting to propose as an opt-in - you can jump into it if you want and be taxed accordingly or stick to private plans.  Let the market decide which is better.  Even if it cost me a little more I would join to support the cause and simplify the miserable billing process and coverage anxiety.  I don't think Medicare could be reliably ramped up to the entire population in one year anyway.Then there's the old burn and pillage form of rolling it out - government seizes the health insurance industry and trims out the bullshit.  Use the former insurance employees as new government employees and get rid of the overpaid execs that think they can do better elsewhere.,
"How is it unrealistic to extend medicare to everyone?You learned the wrong lesson from 2016. The lesson is that people are tired of neoliberal policies which tell the working class that they have to be crushed by pro-corporate policies. If the working class demands to no longer be exploited pro-corporate democrats will say ""Oh please. Don't be so unrealistic. Your anti-corporate policies will never pass"".If history shows us anything it's that politicians don't change society via ruthless pragmatism. Mass movements change politicians due to fear of upsetting the status quo.With a mass movement we can take on the private insurance industry. ",
"The comparison with gay marriage doesn't scan because the proponents of gay marriage were forthright and consistent about their goals. By pretending that single payer healthcare insurance is just going to be a painless undisruptive ""Medicare For All"" we're being deliberately dishonest. In reality all that ""Medicare For All"" does is hitch a liberal policy goal to a currently existing government program that is popular and bares a tangential resemblance to the goal. But that resemblance is going to become unhitched under political fire. You're going to run into the same loss aversion politics that killed Hillarycare. As no less liberal a paper than *The Nation* writes:> A common view is that since every other advanced country has a single-payer system and the advantages of these schemes are pretty clear the only real obstacles are a lack of imagination or feckless Democrats and their donors. But the reality is more complicated.Even the jargon ""single payer"" is a smooth bit of nothing that serves to elide the differences between the Canadian British Singaporean German etc. systems. ""Single payer"" is an implicit argument in two words that ""everyone else is doing it so why can't we"" but in fact everyone is doing ""it"" in many different ways.",
"> Polling for universal healthcare is higher than it's ever been.After Hillary retired from SoS and before she entered the primary there were polls that said she was the most popular politician in America; by October she was the second least popular presidential candidate in polling history. Or another example: during the primary as Hillary basically refused to articulate any real criticism of Bernie for fear of losing his voters there were even polls that said Bernie could beat Trump. Polling for anything will be high if the public is only exposed to the For argument and never the Against argument. You can't pass healthcare by stealth. The Against argument WILL be articulated and when it is people will decide they don't want ""Medicare For Me.""",
"This is similar to what Obama said vs. Hillary in 2007. Hillary was the ""universal coverage"" candidate and Obama was the ""affordability"" candidate. And he made the point that what good is it mandating homeownership (for instance) if nobody can afford their mortgage?You're right that loss aversion led to the single biggest political ""hook"" that Republicans were able to sink into Obamacare. About 1 million healthy people lost their substandard plans and had to get new plans according to the new standards. And that by itself nearly sank the program politically and put Obama at risk of losing the 2012 election. Now imagine that but with 70 million people. ",
And if enough people opt-out of those insurance companies in favor of the public option insurance companies will be forced to change their plans and renegotiate their deals with doctors. The end result is that some people won't be able to keep their plan or their doctor and they'll rage that universal healthcare is to blame and should be abolished.Telling people that they can keep their plan or their doctor is not a promise the government can make because it's not under their control. Insurance companies decide what plans they offer and doctors or medical facilities decide what insurance they accept.,
>The cost increase in taxes will be below what most healthy Americans are paying now for their healthcare plans.You are good at repeating what you have heard the advocates keep saying. The problem is nobody knows if this is actually going to be true. THERE IS NO single payer healthcare plan that has received a CBO score; and independent economists (not affiliated with any presidential candidate) absolutely roasted the healthcare plan Sanders proposed in the primary saying he was deliberately promising fewer tax increases than would be needed to pay for it.Look at it this way. Would you volunteer to pay me $1000 today if I agree to pay your rent ($1200) at the end of the month? That obviously depends on how much you trust me. If you trust me absolutely it's a great deal you save net $200. If you don't trust me.. you might be worried that you'll pay the $1000 and then end up having to pay the $1200 too. Now how much do you trust Congress?,
"Jesus Christ dude. Sanders was out as of Super Tuesday. The outcome was in no way in doubt. As early as March 15 he needed over 57% of remaining delegates... while being double digits behind in the polls of every remaining state with over 80 delegates to award. Just because he didn't resign until the summer doesn't mean the game wasn't over in the spring.Obama beat Clinton in a primary system with the exact same rules ""superdelegates"" and all. You know how he did it? By winning large states. By investing those precious small-donor dollars into winning caucuses to eke out the delegates efficiently. By convincing superdelegates. By holding voter registration drives. Bernie did none of that. Instead his subreddit was obsessed with out-of-state phonebanking and photoshopping birds. I say this as an original Obama canvasser: you deserved to lose. If you couldn't beat Clinton you wouldn't have beat any Republican.",
I don't intend to disagree.  I appreciate hearing your broader perspective.  What's troubling for me are not necessarily Trump's little wins along the way but the way in which everything seems so hopelessly divided now in a way that it wasn't before. I look at the things Trump is doing and am flabbergasted at how blatant unethical and offensive they are.  Then I talk to a neighbor or relative and all they can talk about is how unfairly Trump is being treated by the media democrats and people in his own party.  They can't see why Trump is so damaging to everything he touches.  They watch different cable news are shown different stories on Facebook talk with different people about politics and it seems like we are in different worlds.  It seems like the most basic facts become subjects of debate and disagreement.  When the president makes a habit of telling frequent ridiculous and easily provable lies and a sizable portion of the country chooses to believe him because of their hatred of liberals or immigrants or the mainstream media it makes me wonder how we'll ever come back to a place of normalcy.In any case thanks for working long and hard towards this healthcare goal and for sharing your outlook.  ,
> I guess my point is that my current bank account balance and life after aren't effected by something random and unavoidable. We all get sick eventually and socio-economic status shouldn't be what keeps you living a long life.Yes maybe I'm naive but the way I see it's like the police department and fire department. We all pay taxes for their services but don't call upon them daily (or I at least hope not) but one day if we have a need then we all have peace of mind. Could you imagine if our police and fire departments were run the same way as healthcare...,
