comment,leaning
I'm curious why you didn't reply to the other commenter who pointed out that this is a sound political move because it shows that Dems can work together on a real plan while Republicans flounder to even repeal the ACA they've been demonizing for years.You'll never get anything put through if you just sit and wait for it to be politically feasible to pass something. This move is further pushing the idea of universal healthcare into the national zeitgeist. The more it's out there and people are talking about it the more we can strip away the negative connotations and baggage that have been loaded on the idea to slow it down. This leads to more popular support which leads to it being politically feasible to pass it. Politics isn't a one step process.,
You can do that but they're too adept at slinging the accusations right back.It doesn't matter if it's true or not. All that matters is they muddy the waters and if you take the position that you're the one who's righteous ANY indication otherwise is a big win for them.They play this game constantly. That's why you hear all this 'both sides' bullshit up n down the block.Dems need to figure out a good counter to it.Rational and factual arguments only work when the people you're giving them too actually care about facts and rationality in the first place.When you get to a point where your position is untenable as is often the case for right wing ideologies you HAVE to abandon both reason and logic.,
Just one of many situations (like healthcare) where the free market fails. Too often libertarian/conservative economics rely on lab conditions not real world conditions. They want to abolish the minimum wage because they think the market will determine it. Well no because people need jobs. It's not the same as Kroger and Safeway both charging too much for cheese. People can't just not get a job like they can just not get expensive cheese. Same with healthcare. People want it and need it so they'll pay what they have to. All that favors the business owners and insurance companies and hurts the people. ,
"> Even though I was a fan I honestly had reservations about Frankin running for office because he was like seguing his ""celebrity"" into a political career without much political experience to back it up.I don't know what you mean by without much political experience. He had been semi-activist since the 70s and graduated at the top of his class from harvard with a BA in political science. >Now we've got Trump and Kid Rock Trump was first the son of a rich man then the holder of that rich mans empire then semi running for politics then was a celebrity imo. Trump has been wanting to be in politics for a very long time. Either way. Our problem isn't celebrities wanting to be politics or business men wanting to be in politics. None of these are issues. It is the individuals we have issues with. ",
The system is sustainable from a systematic point of view but not from a personal perspective. Each and every person I know who is against single payer did not witness the horrors of our broken system personally and have no empathy for those who did.   It is depressing to think there are so many of those out there. Even those that are very very well off who know very well they are one disease away from being destitute still won't come around.  On a positive note my friend whose little girl has a preexisting condition is starting to agree with single payer and even hold on to your hats admits that Obamacare might not have been that bad and that he has personally benefited from it.,
"What we currently have is not a market option. It's a voodoo option. Nobody has any idea why a box of bandages costs $300. There's no market force attached to the absurd prices we pay for. It's a kabuki theater between hospitals and insurance. Hospital tells the insurer ""OK that kidney stone removal cost $10000"" Insurer says ""We're not paying more than $5000"" Hospital hits back ""$9000"" insurer gives in ""Fine $8000 final offer"". That is how a kidney stone removal costs $8000 and depending on your insurance policy you will pay 0-20% of that $8000.  There was no examination of how in-demand kidney stone removals were. No real market forces at work. Just a lot of back-and-forth between insurers and hospitals which greatly inflates the prices of simple procedures. Not to mention the insurance overhead. If we had a real free market system patients would be able to go online and shop around for operations. Hospitals would transparently list the prices for operations and compete for patients with discounts. ",
Healthcare violates several assumptions that form the basis of a free market.Here are a few:- consumers typically do not have complete information. This is because the product is complex (i.e. I don't know the details of the services I am purchasing because I am not a doctor). Additionally consumers often can't easily shop around because they need urgent treatment (e.g. broke a bone) or they can't travel to other locations (e.g. it's expensive to fly).- consumers don't make rational decisions when their life is on the line. You'll pay more than you should if you're going to die.- barrier to entry is high. Starting a company to compete with existing healthcare providers requires a lot of capital.http://www.triplepundit.com/2011/12/fallacies-free-markets/,
Well the evidence is that every other developed country provides better healthcare for less money than America. So on average everyone will benefit. There may be individuals that are lucky enough to be healthy and accident free and get cheap insurance with high deductibles they never need to pay. These people will probably end up paying more under single payer. You could call  it getting screwed if they are forced to contribute to healthcare they don't use through taxes. They are also getting a lower risk coverage since they are protected should they ever get sick or hurt. In the same way we are screwing people by forcing them to contribute to social security when their retirement savings get a higher yield on the stock market. Or when they pay taxes to unemployment benefits but never find themselves unemployed. The government is forcing people to be protected from unforeseen tragedy like stock market crashes or layoffs. This has a cost but also an obvious benefit. Single payer would also protect people from unforeseen illness. It's am important part of the social safety net the America currently lacks. ,
I won't lie I was originally vehemently against any sort of national health insurance because honestly....we hear about the horrors going on at the VA and that's government run health care right there.  How can they handle it on a far larger scale when veterans are getting the shaft left and right now?  But then again I and a great many like me are getting the shaft anyway with our insurance from work that costs a ton of money and doesn't pay for anything until we hit some absurd number out of pocket.  I think my family's plan is ten grand or whatever out of pocket before Cigna will pay a dime.  So we are already getting fucked.  May as well let the government handle it.  We will probably still get fucked but maybe the insurance companies will get a bit of a pinch from it also.  ,
"Canada. Canada is considered ""single payer"" but many people (including me) have supplemental coverage through our private plans provided through our employer or elsewhere.If I understand correctly the thing that makes it ""single payer"" despite there existing private insurance is that the service provided dictates how it's paid for. If I go to the ER for an emergency or if my doctor orders an MRI it will be paid by the single-player provincial insurance even if I have private insurance. If I go to the dentist or get a massage or other medically-related things that my private insurance covers I can use the private insurance.",
Yeah. Someone who promotes policies which help the working class and are proven to work in other countries is the same as someone who promotes harmful policies to the working class.This is probably one of the biggest false equivalences I've ever heard. Medicare for all is not some pipe dream. We already have medicare. There are already countries with similar systems.The democrats are suffering exactly because they don't represent the working class. The democrats will offer bold pro-corporate policies like the TPP...But then say bold working class policies are too much!I pray that the democratic party does not listen to you. More neoliberalism is not the solution.,
> False. More people coming out was only part of the fight. It was actually the biggest part of the fight. As soon as they started coming out the trend started changing rapidly. >The same conversation can be had with healthcare. People who NEED access to quality affordable care because they are sick or dying can make very poignant arguments about why people should support Medicare for All.Giving gay people the right to marriage cost the straight people basically nothing. It changes nothing in their life. Transforming healtchare will cost almost everyone something -- it will come with HUGE tax increases. There will be some winner and some losers in the net result. If giving gay people the right to marriage was attached to a 5% tax increase for all you would certainly have seen little progress. ,
"> It's not as simple as 'singe payer'. What Bernie has supported in the past is basically expanding medicare for all without handling any of the cost reduction parts that all these other 'single payer' countries do. They tend to limit what doctors you can see when you can see them and for non-emergency issues tend to have a bit of a wait. There is generally a 'gatekeeper' someone that an individual needs to go through for approval to see others.Actually as a Canadian who lives in one of the only countries that has something that actually resembles a single payer system pretty much every single thing you listed here is not true (but is true of other countries that *don't* have a single payer system or something akin to one). There is no limitation on what doctor I can see (other than the fact that doctors won't take unlimited new patients) no limitation on when I can see my doctor (other than the hours she works obviously) and we have wait times for non-emergency procedures but it's a myth that the wait times will substantively increase because when it comes to non-emergency procedures most Americans already have extremely long wait times.There is a talk radio show I listen to the host just said he had to go in for a blood test and another simple non-emergency procedure at the hospital recently he waited 8 hours to do it. You can't just waltz into the ER and get a blood test in 15 minutes here but our wait times are no worse than that. The only difference is that he had a copay and the bill given to his insurer was *two thousand fucking dollars* just for that. Most of that is what they charge you just to walk in the door. My father got his knee replaced last year he waited 6 months to do it. It's an optional surgery so I don't know why you would actually need it to be done immediately unless you are willing to pay an enormous sum for the privilege he didn't have a problem with waiting the surgery went smoothly with no complications his knee is great now and he paid NOTHING for the surgery. And I mean nothing our tax burden here is *lower* than what they pay in NY already NOT including health insurance premiums.There is also no such thing as a gatekeeper here. I don't talk to anyone to get care. If I want to see my doctor I call and make an appointment. If she's not working I walk into literally any walk-in clinic anywhere in the entire province that is open (with no charge). If I have a health emergency I walk into literally any ER in the entire province with no charge and no requirements (other than my health card which also has no charge to acquire or replace).Personally I think the things you listed *are* bullshit I wouldn't want to deal with them and I think they are excellent arguments for why other developed country's health systems have major problems which would be an especially tough sell. Obviously no health system is perfect and I'd love to see certain improvements here (eg dental) but I love our system and I am EXTREMELY opposed to any hack who tries to take us down any path here other than single payer and so is almost everyone else in this country.I also don't agree at all that a single payer health system can have no mechanism to reduce cost. In a single payer system you have all the leverage possible because EVERY customer in your entire system can be unified in negotiation of costs (and government can just set cost levels by law). You also have the largest risk pool possible which in and of itself is a HUGE cost reduction mechanism. I mean christ the US already spends more than DOUBLE what Canada does per capita on health which doesn't even touch the actual cost of health premiums even after PPP adjustment. We also spend less than Switzerland Netherlands Germany and Denmark (and others).Just to conclude it is SO easy to shit on everyone else's ideas you don't even have to be accurate to do it. You have painted a very excessively negative view of single payer and the situation in the US I'm not really sure why. There don't have to be as many sacrifices as you are making it sound and a system properly implemented has every ability to save HUGE amounts of money from what the US currently spends as well as for most if not all people in the country. It's not even clear that taxes need to go up everywhere (the 'welfare queen' states with unsustainably low rates and net negative output notwithstanding). $4600 per person vs $9600 PLUS premiums PLUS you have 10x the risk pool and negotiating power. This isn't some massive burdensome layer of cost on top of everything else you have the potential to save literally trillions of dollars while massively increasing your health outcomes. We literally have higher life expectancy which means more of the costliest years of life for every person in the country yet we STILL pay less than half per person with zero health insurance premiums.Don't get stuck on the convoluted and restrictive systems in the EU many of them eg Switzerland which is arguably most similar to the ""ACA done properly"" model is quite restrictive relies on out-of-pocket costs to reduce health care costs by forcing people to pay huge sums of money to use the system and thus often choose to just accept the health consequences of not using it (or subsidize public health spending with hidden costs) AND still spends like 50% more per capita than Canada. Their health outcomes are only marginally better in most metrics and I suspect that they would have serious problems with the viability of their system (and the strength of their metrics) if they actually allowed any amount of substantial immigration like Canada and the US.",
"One thing about the economic analyses is that they're almost always wrong.   The economy is too complex to predict. I think the Modern Monetary theorists are correct so the Federal government can afford to let deficits/debt rise a lot higher than many economists would be willing to push for i.e. inflation is a theoretic risk much overblown.So to do this politically just change the Medicare laws to age=conception and then let things sort themselves out deal with issues as they arise make adjustments but let the Fed cover it all while in this period.I think it can be done precisely because people will think of it very simply.  After all the more complexity introduced up front to try and anticipate all of the outcomes is how and why HillaryCare and Obamacare failed. (I'll be 51 in a couple months and remember it well.)  But if you get enough people behind it and pass it ""as is"" the insurance/pharma lobby can be overcome and as things work out as it goes along that lobby will be less and less powerful. (The goal being to reduce or even eliminate private insurers--there will always be an option for the rich to buy their way into superior health care but most people shouldn't need it.)  Medicare for all puts it beyond state politics and insurance finagling (the two big problems previously).Edit: typos",
>And a united Democratic party in message and purpose can change that.>People don't give a fuck about the nuts and bolts of policy. Why do people keep assuming they do.>>Find a good message and hammer that baby home. Stop trying to explain the underlying model of healthcare and blah blah blah.... Use impactful emotional rhetoric (as long as it's grounded in reality) that's why the GOP is so powerful and the Democratic message is so weak. So basically decide that single payer is the only way to go and demand it instead of actually looking at what might be the best and most affordable way to achieve universal coverage in the US? Maybe the answer is single payer maybe it isn't but we'll never know if we skip that part of the discussion. I thought dogmatic adherance to a policy idea no matter what was something that Democrats were against. ,
"The democratic party is bought by corporate interests. Look at the money. Is the democratic party more liberal than the republicans? Sure. But that doesn't make them automatically really progressive. The democratic party right now is pretty much moderate republicans. >A person who has self-described as a socialistic democrat damn near won the democratic primaries.You're confusing the democratic establishment with its voters. The democratic voters have always been more progressive than the establishment.>And anyone supporting the republican or libertarian positions has absolutely no ground on which to complain about another group representing corporate interests.Of course. But we should be able to hold Hillary Clinton accountable for her terrible anti-progressive positions. And it doesn't make us a republican or libertarian.Good to see this same argument repeated over and over. ""Neoliberalism is pretty progressive! You have no other choice but to support neoliberalism. Yay!""..> It sounds like you're trying to turn this into a team game rather than considering what other people actually say. Yes. I am. The teams are the working class versus two corporate manage parties. The democratic establishment are enemies. They are not allies.",
"I think the more important point is that it's not going to work. Yes there is currently 57% polling support for ""Medicare For All"" because as I said *Medicare is a currently popular government program.* [But the moment people are exposed to the most anodyne right wing talking points like ""the plan could extend government control over healthcare"" support drops to 40%.](http://www.politico.com/magazine/story/2017/09/12/single-payer-democrats-litmus-test-bernie-sanders-215600). So the point is not whether we can agree that it's a cynical trick or a ""comprehensible bridge to a political future"" (which I would contend is just a way of rewording ""cynical trick"" btw). The point is that the bridge falls apart the moment there is somebody on the other side arguing against it.",
Wasn't expecting any inspiration out of this but damn thanks! It's definitely a struggle though for real. I'm a freelancer in CA so when I lose my health insurance (in two months - currently covered by my father's) I won't have any employer to sponsor insurance for me. My options at this point seem slim. Pay my bills and don't have insurance? Give up the dream get  a shit job just so I can have insurance? Not a good situation either way - but definitely not willing to give up the good fight. Hopefully something good comes out of all this soon. Either way I'll keep voting and keep supporting those that care about the people. Cheers man!  ,
Vermont magazine Seven Days reported Tuesday that the 74-year-old senator and his wife Jane Sanders have purchased a four-bedroom house on the shore of Lake Champlain for roughly $600000. Jane told Seven Days that they had recently sold a house in Maine that had belonged to her family since the 1900s and used the proceeds to purchase the new property which is located in North Hero (population 803 as of the 2010 census). With this purchase Sanders now owns at least three houses the others being in Burlington VT and Capitol Hill in D.C.Sounds reasonable to me. The dude has been a representative for nearly 30 years. If that's all you have to complain about I'd say he's done quite well.,
Hey I pay those taxes too and have been paying them every year of my adult life. They are socialist programs that made our society better. It's time to update them because things have changed. Where I live (San Diego) the income gap has widened while availability of affordable housing has decreased. This has led to a massive increase in the number of homeless who have created a shanty town in part of our downtown area. It was all fun and games for awhile but now there's a fucking Hepatitis outbreak. I live in what is supposed to be the nation with the highest standard of living in the world but I have to be careful of where I go to make sure I don't get an entirely preventable disease. It would be fucking nice if some of my taxes could go toward making sure these types of things don't happen. ,
I'm not talking about affordability I'm talking about outcomes.  There is a very real and significant risk that it takes the US government a decade or more to implement a system that can come close to the healthcare coverage that I have.  There is the complete possibility that this gets passed there is a huge backlash and Republicans then control it and dismantle it in ways beyond our imagination.  Single-payer is probably the dumbest way of going about Universal Healthcare that we could possible conceive it ignores our current system the risks involved the unintended consequences (ie: collapsing insurance markets before it can be fully implemented as just one example) and ignores the fact that the US has probably one of the only governments where half of the elected officials believe that government is the problem and doesn't work.  Universal Healthcare is something that we all want probably from right of center to far left.  But let's take the surest and most efficient path to get there which would be a multi-payer system with a public option.,
> Savings from health tax expenditures.Revenue raised: $310 billion per year. Several tax breaks that subsidize health care (health-related ‰ÛÏtax expenditures‰Ûù) would become obsolete and disappear under a single-payer health care system saving $310 billion per year.Most importantly health care provided by employers is compensation that is not subject to payroll taxes or income taxes under current law. This is a significant tax break that would effectively disappear under this plan because all Americans would receive health care through the new single-payer program instead of employer-based health care.His biggest line item except his payroll tax is speculative.  $310000000000/annum is $1000 per person in the country per year.  > A 2.2 percent income-based premium paid by households.Revenue raised: $210 billion per year.This year a family of four taking the standard deduction can have income up to $28800 and not pay this tax under this plan.A family of four making $50000 a year taking the standard deduction would only pay $466 this year.That's a 10% tax hike on what you're paying to the government now if you make under 70k/yr. He's replacing a $3000000000000 plan with a plan that is funded for $1380000000000 per year.  What if the new plan costs nearly as much as the old?  What if it costs 2/3 as much. His plan could have a $700000000000 budget shortfall even if he saves 1/3 of the cost of the ACA.Generally speaking I don't like buying something when a politician tells me what it's going to cost.  I don't trust the price quote but I'll let you make your decision.,
"The person I was responding to just said ""This will cost a trillion dollars"" without context. You know who does shit like that? Every republican and centrist liberal who wants to oppose single payer; either ideologically or to protect vested business interests. If you say ""This will cost 1 TRILLION DOLLARS"" without mentioning that it currently costs 1.3 trillion then you are trying to scare people with large numbers. As to your comment what was technically wrong about my comment? Single payer is cheaper. Not just cheaper per person using it; it's cheaper overall. With single payer you can cover 100% of people and it will still shrink the cost to the overall economy. You also get better outcomes for people that do use it. It's been proven true in every major nation -- their healthcare costs constitute a smaller portion per capita while still covering everyone. ",
Well yeah. He lost. Although he had a lot more cards stacked against him at the start of the race and never got the media coverage he deserved so it's no surprise he lost. What's surprising is how well he did do. He went from a virtual unknown to winning over 40% (I forget the exact figure...44.2%) of the Democratic primary vote and he did it with almost zero media coverage.  I would agree that he was a terrible candidate at the start of the 2016 primary if only for the fact that he was completely unknown compared to Hillary.  But the fact that he did as well as he did despite starting in a much more handicapped position and without favorable media exposure and against the Clinton/DNC machine says to me that he's a fantastic candidate who would have destroyed everyone if given the exposure he deserved. Look at his approval numbers in VT to see how well he represents his constituents.  Look at the percent of REPUBLICANS in VT who support Senator Sanders.  It's crazy.  ,
