comment,leaning
As a Canadian it always blows my kind whenever I read the debate about healthcare in America. I want to share my experience with appendicitis that happened about a month ago. Woke up in terrible pain in my lower right side called telehealth (free Ontario nurses who can help diagnose you) and was told to go for the ER. Went there got registered as a patient and it took about 6hrs for me to be diagnosed (scans blood urine results). I was in surgery within an hour. They kept me over night. I was told I could leave about 24hr after I arrived there the previous day. The only papers I was given were post surgery advice and couple signatures before surgery for liability reasons. Paid $15 for pain medication at the pharmacy. No bills. ,
To everyone complaining about their taxes going up or whatever you never know when something catastrophic could happen to you or your family.My dad was a healthy 45 year old who one day got a sinus infection that turned into bronchitis that turned into asthma/COPV and some mystery illness. He stayed sick for 15 years until he died.After a couple of years he had to quit his job because he worked with the public and he couldn't stand the smell of women's perfume without having an asthma attack the kind that would send you to the ER.So we lost half of our income while our medical bills went through the roof; we were going to the ER at least twice a month sometimes staying in ICU. Between the hospital visits doctor visits and prescription drug costs we almost lost our house and went bankrupt. Both my mom and my dad just had basic jobs that didn't require a college degree.This practically happened overnight. The doctors never figured out what the mystery illness was but my dad was too sick to go to his own mother's funeral.Granted this was before the ACA so I don't know how that would have changed things but we had my mom's insurance and still almost lost everything. Only family stepping in and helping with groceries and bills saved us.It was a nightmare. Something has to change.,
>that same survey found that when respondents were told that a universal healthcare plan might give the government ‰ÛÏtoo much control‰Ûù or that it might increases taxes opposition spiked from 43% to 62% and 60% respectively ‰ÛÒ perhaps a sign of the major political and policy fights that lie aheadI'm continually amazed and disappointed at how many people have been conditioned to believe that government administration is inherently tyrannical. In the case of healthcare it's not the *government* which makes it tyrannical it's the *profit motive*. The government isn't going to screw people and deny services so some bigwigs can make a fortune. But insurance companies *will*.,
When it comes to bills like this there will always be compromise. Why do you think Obamacare became washed down socialized health care? Even in the hypothetical future the Dems will still need some R support for an eventual healthcare bill. Bills this large cant get by without at least some level of bipartisanship. Some of the stuff in this bill simply will not ever be signed off on by the GOP. Even if the GOP sides with public opinion on Universal Healthcare some time in the future I cant see them folding on their tax philosophy. Thats why I feel arguably the most controversial aspect of this bill is the tax hike on people making over 250k.  ,
Why do people get excited about the tax cost Medicare for All would impose? Do people not realize that their insurance premiums are just as much if not more than a MFA tax? Right now I have a shitty HSA for my son and I and that still costs me $180 per check and I basically have nothing to show for it but catastrophic coverage. I pay everything else out of pocket until I hit my $5k deductible. I could pay about 10-15% in MFA taxes end up at my same take home pay AND I WOULD HAVE VASTLY BETTER INSURANCE COVERAGE.I have fucked up shoulders that need help but I'm not able to afford the out of pocket costs or the MRI and subsequent PT/surg I would need in order to fix my shoulders. It's so fucked that I along with basically all other Americans can't go and get the help we need because it's simply too expensive. AND THAT'S WITH INSURANCE!!!We need to get the fuck off private insurance and begging a ground to ceiling medical reform initiative in this country. Our medical access is fucking garbage. ,
I think this has to be the end goal but even as someone who believes that and who loves Bernie I think Murphy's plan might be the better option for right now. It's essentially a public option allowing people to buy into Medicare (likely for cheaper than most private options). The hope would be that as more and more people just move to Medicare on their own and like it it makes single payer much easier to sell. Plus shouldn't be much reason for republicans to oppose it - they always claim to be about choice and options this is just another option.The obvious downside is it doesn't get us to full coverage until however long it takes to eventually transitition to single payer and that's an issue. I haven't yet read Bernie's bill but I've read a couple summaries and both said it's vague on how it will be paid for which I kind of expected. ,
This needs to happen. My daughter just got out of the hospital (she is doing well - not looking for sympathy). It was a children's hospital and it was a soul crushing experience. Not just because of what my teen daughter had to go through but seeing and hearing these kids some of them tiny babies in such pain. We are lucky I have great insurance. I pay $1000.00 a month for it but luckily I can afford that. We were in the hospital for about 3 weeks I saw many families come and go and found myself wondering how many of them would experience the relief of having their child well again dampened by the depression of having astronomical bills that they can't afford. That shouldn't happen in the richest country in history. It is criminal.,
"I've signed a petition for single-payer Heath care and donated to this cause. We need this. Please everyone if you don't know much about this issue [do your research!](https://www.citizen.org/our-work/health-and-safety/single-payer-health-care-all)If you believe in single payer healthcare volunteer [sign petitions](call your representatives go to town hall meetings and speak your mind. Demand change in areas that match up with beliefs supported by factual evidence Donate if possible protest PEACEFULLY make your voice heard.[SIGN PETITION](http://action.citizen.org/p/dia/action3/common/public/index.sjs?action_KEY=13188) Bernie's ""Medicare For All"" Single-Payer Healthcare Bill (one mentioned in post)And please please please be sure to do your research. Like Bernie said many greedy people will spend massive amounts of money in an effort manipulate people to vote/work against their own interests. They only want to preserve their fortunes. Find legitimate sources read from multiple sources etc.America needs this. And remember: Facts > Feelings! Well known causes to check out:[American Civil Liberty Union](https://www.aclu.org)[Southern Poverty Law Center](https://www.splcenter.org)[Public Citizen](https://www.citizen.org)A great website to start volunteering:[Volunteer Match](https://www.volunteermatch.org)",
"The country is still much better off accepting the fact that today far more people like the PPACA then they did when it was passed.  The very foundation of it is Republican in concept (Heritage Foundation).Single Payer is never going to really work because the government grossly overpays for everything it buys. Moreover this is a country that can't properly take care of their own veterans...what makes ANYONE think they can take care of everyone?The reality for me is Republicans need to accept the reality that ""Obamacare"" is a far better solution than Trumpcare (which would send tens of millions to uninsured - ergo just recreating the problem we had before Obamacare) and it's far better than expecting the government to accurately provide health care for 320 million people.  Having the government actively oversee and coordinate private industry insurers....putting reasonable price controls in place and providing need based credits so EVERYONE is insured by private industry is the most efficient solution to the problem.  The PPACA needs significant repairs but the guts of it are the best compromise solution there is.Unfortunately neither side gets it.",
"Some easy ways to cut other costs to help pay for such a system:    - Cut insane military spending. So much of what we spend tax dollars on is bloated obsolete overkill nonsense leftover from the WWII/Cold War era. How many nuclear missiles do we really need? Bombers? Fighter jets? And so on. It's absurd.   - End the ""war on drugs"" (I seem to recall that we learned at some point in the past that prohibition does not work) and tax and regulate the various banned substances that costs us a ton in policing and imprisonment. I'd rather my tax dollars be spent on improving the health and happiness of myself and my fellow citizens than on either of those two harmful and outrageously expensive endeavors. ",
Though I respect and completely agree with Senator Sanders in that United States NEEDS universal healthcare.  It is long overdue it is something that is workable in real life and not modeled in a computer simulation.  There are plenty of Countries in which to study how it is applied and administered in their Country.  Canada comes to mind.That being said this sub is sounding more and more an echo chamber with nobody chiming in playing the devils advocate.  There is a lot of hard work and a long rough road that lie ahead but this needs to be debated openly and discussed with respect.  We need to populate this discussion with others with opposite opinion that make a compelling argument for their side.,
If Democrats want to win here's what I think might work:1) Universal healthcare yes... but also:  2) More restrictive immigration controls. People would be more ready to buy into Democrat wealth redistribution programs if Democrats didn't also support bringing more low-skilled workers into the country.  3) A rethink of welfare when it comes to what it incentivizes people to do. Put forward some ideas for how to continue providing welfare but in such a way that it discourages welfare recipients from having kids.  4) Less emphasis on gun control. Law-abiding gun owners don't want to be punished for what law-breaking gun owners do.  5) Get tougher on violent crime but without increased police authoritarianism. Democrats have a tendency to make too many excuses for violent criminals. If Democrats advocate for better policing but put forward ways to achieve this without giving police more draconian powers they could win with multiple constituencies.6) Military spending cuts would be a good idea in my opinion but the problem is that most people have very little understanding of military realities and it is easy to fearmonger claiming that such spending cuts would significantly damage US security even if they wouldn't. Democrats might be able to make some headway on the issue by emphasizing foreign aid cuts and cuts packaged as attempts to increase efficiency. Unfortunately a too-direct attempt to tackle the issue might cause ill-informed people to react in fear as if the nation was being made less safe.,
Look instead of making Medicare mandatory for everyone why not just open it up as something that people can buy into? Everyone has a Medicare deduction come out of their paycheck now (or if self-employed they pay into it yearly)... why not just make it an option to double your contribution to and then you'll be on it as a primary insurance? You can still buy supplemental private insurance through your employer or on the open market to fill the inevitable deductible gaps (as a lot of senior citizens do now) but your catastrophic coverage is guaranteed.I don't see how this is rocket science. The additional payroll contributions should go a long way in paying for the additional expenses.,
I know I'm going to be downvoted but whatever. This is the same typical hot air from Sanders. His big head is so full of it I'm surprised he hasn't floated away. There's no chance this bill will actually be voted on by the Senate let alone pass. This is political branding nothing more. He's trying to portray himself as some crusader of the people while simultaneously accomplishing absolutely nothing. This is political grandstanding to a minority of Americans who already make up his base. It's not reaching out to anyone new and he knows he won't be held accountable to his promises because it's never going to become a reality anyway. He can say whatever he wants and the people will eat it up. This is no different than Trump spewing bullshit and his supporters lapping it up because it's what they *want* to hear.,
That's cool. Did he introduce it on the state level first to see if the plan is viable? If it's so much cheaper then obviously it would be a gigantic hit and all the states would just implement it themselves right?No?So basically he wants a completely untested system being implemented nation wide that could very well bankrupt the entire nation? Awesome!As an independent sick of both parties I'm going to have to say no. States are meant to be a testing grounds for this kind of thing. If not a single state is willing to try it themselves...why should be force it on the entire nation? If the voters of a single state don't find it attractive enough why are we attempting to force it on the entire nation? Make it work on the state level first. Until then I can not vote for any person that advocates for nationalized healthcare. I want to see it successfully implemented in at least ONE state before forcing it on all of us.,
>The new system would be underwritten by an increase in taxes.this is where you lose my approval.  There is NO NEED FOR A TAX INCREASE TO PAY FOR SINGLE PAYER CARE.We spend 10s of BILLIONS a year on military.  We send BILLIONS a year to other countries for military aid.  We send BILLIONS MORE to other countries and companies for subsidies.Want my support?  Fix the spending and re-apply appropriate fiscal budgets to the healthcare issue.FISCAL RESPONSIBILITY.Raising taxes on an already over taxed country to pay for a program that should already be budgeted is fucking ridiculous.,
"This won't pass. There are too many problems with it and I'm all for single-payer. First and foremost -  Nobody wants increased taxes. The statement that ""Companies currently paying your premium will now be able to boost your wages"" is laughably unrealistic. No these companies will give that money right to their shareholders. You're going to have to convince people that the increased taxes offset the decrease in insurance spending. To really fix our healthcare system you're going to have to break a lot of things and rebuild from the ground.There are simply too many health insurance companies and hospitals that rely on our overly complex and bureaucratic maze of a system to extract profit from customers. The people in health insurance companies millions of employees in total will be out of a job. More importantly for the success of this legislation is that these companies will cease to exist. They will fight tooth and nail to protect themselves.Ultimately I do believe universal healthcare is possible but we first need to completely re-engineer the healthcare system. We need to get rid of the existing Medicare/medicaid alongside with private insurance and build a new system that accurately reflects costs. Hospitals are directly responsible for this. So long as they continue to charge insanely overpriced fees to the government and private insurance companies we will never be able to get rid of our current system. IF and that's a huuuuge if hospitals agree to set prices of procedures and goods to a realistic price this would be the first step of many. Next you'd have to deal with multi-billion dollar private health insurance companies facing extinction and somehow compensate for the economic impact of billions of dollars fleeing from capital markets and millions of employees finding themselves unemployed.Finally you'd have to find a way to get around the private sector using health insurance as a way to retain their employees. Again you're dealing with lobbyists with a vested interest in the status quo and deep pockets to keep it. If you can convince corporate America that they're better off not having the competitive advantage of employer-provided healthcare then you might just get away with it.All these things together present a near insurmountable hurdle. Our system is clearly and undeniably inferior to single payer in other first world nations but the amount of work we'd have to undergo to fix it would cause so much grief and divide that it really comes down to whether or not its survivable without fracturing the nation.TL;DR: Raising taxes and expanding govt-subsidized healthcare won't work. Healthcare as a right needs to be built from the ground up as a new system. That means that the old system will have to die a painful death that will wreak economic havoc. I don't think we're capable as a nation of opening wounds like that. I hope I'm wrong.",
>During the first year of the program the eligibility age for the Medicare program would drop to 55 and all Americans under 18 would be added to the program. The eligibility age would gradually decrease until the fourth year when everyone would receive a ‰ÛÏuniversal Medicare card‰Ûù.And money won't be going to CHIP and Medicaid for those under 18 or for seniors (Medicaid). This is why he ran. He wanted to build support. The thing that drives me crazy is people act like they have zero creativity when discussing this stuff. They talk about taxes going up and how half the population will get it free off the backs of others because they don't pay any taxes. But it doesn't have to be that way. They could design the program so that you pay your Medicare for All premium whether you owe taxes or not or at least a portion of it. If you receive some other form of government assistance it could be deducted from that prior to disbursement. ,
"This is the best tl;dr I could make [original](https://www.theguardian.com/us-news/2017/sep/13/bernie-sanders-universal-healthcare-medicare-for-all) reduced by 94%. (I'm a bot)*****> Battle lines have been drawn as Bernie Sanders launches his latest attempt to establish a healthcare system that covers all 323 million Americans.> Since Sanders launched his presidential campaign in May 2015 public support for universal healthcare has climbed.> Sanders said he was open to other approaches that push the country toward universal healthcare but said he believed that Medicare for All modeled after the Canadian healthcare system was the most logical path.*****[**Extended Summary**](http://np.reddit.com/r/autotldr/comments/6zwwb3/bernie_sanders_unveils_universal_healthcare_bill/) | [FAQ](http://np.reddit.com/r/autotldr/comments/31b9fm/faq_autotldr_bot/ ""Version 1.65 ~209123 tl;drs so far."") | [Feedback](http://np.reddit.com/message/compose?to=%23autotldr ""PM's and comments are monitored constructive feedback is welcome."") | *Top* *keywords*: **Sanders**^#1 **healthcare**^#2 **bill**^#3 **program**^#4 **Medicare**^#5",
Will the Medicare for All bill (and subsequent bills cover)1. Health Insurance worker compensation (3-5 Million Unemployed Rest folded into government another government cost)2. Reduction of Pharmacy and Medication cost which will result in excuse by Pharma Bosses to reduce worker force3. Reduction of Hospital Costs which will reduce hospital staff4. Reduction in Physician salaries which are among the highest in the world. **in USA avg. Salary of Physician in  2008 was $186582 versus $125000 in Canada $159000 in Britain and just $92000 in Australia* The gap is believed to be even higher now in 2016.Not only will this be a Medicare for all bill this will cut the entire healthcare industry (which have jobs) for much lesser healthcare industry in SIZE but it will give the start to begin taxing people to cover the remaining cost after all the slashes to overhead mentioned above is done.,
>Standing in opposition to Sanders‰Ûª plan are what he calls the ‰ÛÏmost powerful and greedy forces in American society‰Ûù: the pharmaceutical industry insurance companies Wall Street and the Republican party.Pharmaceutical companies are actually in favor of a system like this. It would allow them to up the costs of prescription drugs to even higher price points because the government would be footing the bill for it.If you really want to cut healthcare costs let Americans buy medication from other countries and prescription drugs without having to visit a doctor. Decriminalize Marijuana and other drugs as well and you'll quickly see healthcare costs drop drastically as medicine that normally cost hundreds of dollars per pill drops down to a few bucks.,
Here‰Ûªs a full list of the bill‰Ûªs co-sponsors as of Wednesday morning:Elizabeth Warren of Massachusetts - Kirsten Gillibrand of New York - Cory Booker of New Jersey - Kamala Harris of California - Jeff Merkley of Oregon - Richard Blumenthal of Connecticut - Brian Schatz of Hawaii - Mazie Hirono of Hawaii - Sheldon Whitehouse of Rhode Island - Patrick Leahy of Vermont - Ed Markey of Massachusetts - Martin Heinrich of New Mexico - Tom Udall of New Mexico - Tammy Baldwin of Wisconsin - Al Franken of Minnesota - Jeanne Shaheen of New Hampshire - [from Vice News](http://https://news.vice.com/story/heres-whos-backing-bernies-medicare-for-all-bill)(Edit: stupid paste)   ,
Has Bernie ever presented any kind of timeline he thinks this could get done in? I'm worried that when it doesn't pass the first couple times that people will lose hope and get apathetic. I'd like to know what he plans to do about that especially since he is rather old and won't be around to save us forever. It's not like he has a prodigy that will take over for him and clearly liberals are lacking leaders they really like. Beyond just sticking with a push for Single Payer how do you keep people interested when they get their hopes up and then get disappointed some because I'm pretty sure that will happen at least for awhile. We aren't going to go from Trump to Single Payer in 4 years and even 8 seems like a short time for that much of a swing. I think it's possible in 6-8 but not 4. AND It's only possible if liberals vote like they mean it for 6 years in a row three BIG elections and all the little ones in between! YOU CAN DO IT! However I want Bernie to tell you that.How will he fight the potentially long fight that this will take without losing support for not getting it passed in 2 or 4 years? That's really always been the question with his big promises HOW and WHEN and HOW! How can anybody keep liberals motivated to vote! They love to dream big and they love to embrace apathy when they don't get what they want. It doesn't seem like it will be easy. We need more charismatic liberal leaders.,
"It would actually be really bad if it passes since it's not a complete bill. Much like every past time Bernie has pushed a bill like that it hasn't included how to pay for the change and all the other details needed to make an actual Medicare for all system.There's a reason why the ACA was over 300 pages long. It needed to be to properly outline how to have a healthcare system and cover all the things needed in that topic. If Bernie's current bill passed it would basically be a ""healthcare system"" with nothing to actually enact it with. And I certainly hope Republicans don't try to pull a bait and switch where they pass Bernie's bill as a way to get rid of the ACA without having to do anything else.•ÈÀ",
Honestly I'm getting a little frustrated at sanders here if you want this to be a meaningful discussion on how to do healthcare you need your bill to be costed. If it isn't it just doesn't matter. How much will this plan cost where will that money be raised what happens to the tens of thousands of americans who work in Health insurance offices what do we do to ensure that the doctors are not overbooked when appointments are free and there is no barrier to use.  I want to see you guys get Single payer it is where you need to go but we need to talk seriously about how you cross the crocodile infested waters between here and there. If you want to tax the rich fine but you need details how much money needs to be raised 1 trillion? 2? 1.346 trillion? If so what kind of tax rate increase does that represent on corporation tax on estate tax etc. Is it 8% increase in income tax for the top 10% of earners is it 9.5%?    This plan has symbolic value it may even have campaign value in 2020 but it leaves so many unanswered questions :/ ,
**Couple questions**1) 1/3 of the funding is estimated to come from the states how in the world is the federal government going to convince 34-35 Republican governors to sign such a law?* Also 69/99 state legislature are Republican controlled* Most states have a 60% vote threshold for passing a large tax hike which makes it harder.2) How is Sanders plan going to get doctors to join the public system when they are paid much less?* I ask because Sanders during the primaries said he would make it part of the law doctors have to see public option people this would be a SCOTUS challenge and I don't see even Liberal justices like Kegan or Byer supporting that3) Colorado had a referendum for the basic level universal system and it failed 80%-20% so how are they going to convince people?4) To pass a law like this would take 60 votes in the senate and I don't see Republicans and even moderate Democrats supporting this.,
