comment,leaning
"It's funding sources are pretty wide and he's assuming that it will be cheaper than it might end up being so if he doesn't get every source of funding he's looking for here or if he's wrong about the cost the entire plan will be dangerously under funded.As a campaign tool fine. I'm not impressed with it but you're right it's better than the Republicans plan.The negotiation thing.  Ok so until recently I worked in healthcare the expectation night far exceed reality here.  Medicare already negotiates shockingly low rates and my insurance provider only paid what Medicare paid.  It was among the lowest in the country and was a constant source of pain for healthcare providers.  Several threatened to stop accepting our insurance over the reimbursement rates but thought better of it when they realized patient population was a thing.  It's not the providers you need to negotiate with. There are a lot and I mean a metric fuckload of factors driving up healthcare costs.  And they each need to be addressed.  Cost of education lack of professionals profit driven care profit driven pharma and equipment which is an entire industry in and of itself and speaking of entire industries profit driven insurance the list goes on.  **There is no simple solution to these problems**.  And any solution will by it's nature kill thousands of jobs. Health insurance alone employs millions of people. It's could be as much as 6% of the economy.  A 6% reduction in the economy is also called ""recession."" There are real problems here and they need to be addressed.  As a campaign tool you have millions of people who's job kind of depends on it failing. And these are low income people. And not to put too fine a point on it but 2016 was in part decided by a few thousand people who were worried about their jobs.",
"- [Veteran Democratic operative Donna Brazile finally admitted that she used her former position as a CNN commentator to relay questions ahead of debates to Hillary Clinton during the Democratic primary.](http://www.washingtonexaminer.com/donna-brazile-finally-admits-she-shared-debate-questions-with-clinton-campaign/article/2617742)- [It was revealed through WikiLeaks that the DNC was conspiring against Sanders potentially planning on attacking him based on his religion (or lack thereof) or planning to undermine him claiming that he was incompetent.](http://www.huffingtonpost.com/entry/wikileaks-dnc-bernie-sanders_us_579381fbe4b02d5d5ed1d157)- [Clinton also commanded a lead from the start among the Party's superdelegates.](http://www.latimes.com/politics/la-na-clinton-sanders-democrats-20160516-snap-story.html)- [The debate schedule was created deliberately to prevent as many people as possible from seeing them before their time to vote and despite the fact that ""other campaigns have advocated (not surprisingly) for more debates and for the schedule to start significantly earlier.""](https://wikileaks.org/podesta-emails/emailid/5688#efmASYAcT)The DNC had had their winner picked from the start. All they wanted to do was put on an act of democracy.",
How about when Brazile passed debate questions to the Hill camp and did it multiple times.She denied it for months but after immense public pressure buckled and apologized for it and said it was wrong.http://www.salon.com/2017/03/20/finally-donna-brazile-apologizes-for-passing-debate-questions-during-clinton-sanders-primary-battles/And if the future Interim DNC chair did that who knows what else top DNC officials had done to tip the scales.Or what else Brazile did that went under the radar. Not to mention that HRC didnt come out and denounce it as soon as the debate questions went to her.I also suggest you read the internal email exchanges on the DNC on how they planned to sabotage Bernie's campaign. Or how they limited polling places in heavy Bernie areas.And thats just the tip of the iceberg.Or how about the fact that HRC with her name recognition brand and last name went up against an unknown jew from vermont and it took all the political capital she had and external help to bury him.Imagine if she had none of that?She would have been smashed.Stop bringing this crap up again its over for HRC. Shes the past Bernie is the future.Hes making that known right now with this bill.,
If you read any of the leaked DNC emails you would know there was a lot more wrong with what they were doing than that. There was a lot that went wrong and all of that was a big reason why Debbie Wasserman Schultz had to step down after the leaked emails came out.Also the DNC was working to make Clinton their candidate before any midterm elections ever happened. That's a big problem. The party isn't a single candidate and if someone wants to run in that party they should be able to have the opportunity to do so without being sabotaged against.,
"I am in no mood to take up 20 minutes of my time to debunk you. So this is the only comment im making.Im done talking about HRC on this sub and the amount of her apologists on this sub is disturbing during the election she was hated here. And rightfully so.Yes Clinton has a brand its her name which she owes thanks to her husband.She sticks her neck out when convenient and flip flops more than a fish out of water.There is no such thing as ""free stuff mannn"" its paid for via taxes the taxes are just allocated in a better way.Education and healthcare for all would cost more in taxes but that cost would be offset by having no more premiume and no more deductibles.Not to mention the thousands saved in student fees. You know this dont be obtuse.And yes sure i can believe that quote. I give you that but hes making headway now But thats just 1 example i can point out dozens about Clinton.",
And I would argue that no-one knows another person's need and ability better then that person themselves. So setting up a beurocracy to determine who needs what and who has what ability will only lead to people who need not getting what they need and those with some ability not using it so they won't get targeted for extra work to cover those who may or may not have greater needs than their own. Not only that but lobbying will become even worse and the wealth divide will widen as those with the power become those with the greatest need.Talk about a race to the bottom.,
You are abusing statistics to make a false point. Canadians don't wait any longer than Americans for serious issues and not much longer than American's in urban areas for anything non elective. Canada has a larger percentage of their population spread out in rural areas so yes it takes longer to see a doctor when you live 150 miles from the nearest thing that can qualify as a city. Your previous statement that thousands of Canadians cross the boarder to get treatment is also bullshit. They did a study. http://content.healthaffairs.org/content/21/3/19.full That's a myth propagated by the right.And if you don't like Canada's system then we don't have to model ours after theirs. There are dozens of other countries with systems better than ours. People who are against single payer always point to Canada for some reason like it's the only example of universial healthcare.,
"It's not ""making sure nobody confronts the bad"". It's being honest about the very obvious fact that the downsides of typical universal healthcare system are minuscule compared to the downsides of the American healthcare system. Making a huge improvement is worth it even if there are some bad aspects to it. Anyways the USA will almost definitely have universal healthcare within 10 years. So you can continue to say you talking points against universal healthcare and talk about how it is basically slavery. The rest of the world is happy with their universal healthcare and it's becoming more and more obvious that the USA cannot continue to be so backward in this respect forever.",
Cool argument that would work if we didn't rank near last when it comes to quality for the amount we pay. We pay by the far the most and we get the least of it when you compare us to other industrialized nations. >Are you suggesting that everyone should be happy to see their quality of care decline and massive wait lines and higher taxes take its place?I'd like to find a solution that allows people to access health care without going bankrupt. Or having to use the ER for little things because they can't afford insurance. You see things like that will have an effect on our costs whether you like it or not.But I can tell a solution isn't what folks like you are looking for just repeating the same broken record argument about taxes and waiting lines.,
Single-payer national health insurance also known as ‰ÛÏMedicare for all‰Ûù is a system in which a single public or quasi-public agency organizes health care financing but the delivery of care remains largely in private hands. Under a single-payer system all residents of the U.S. would be covered for all medically necessary services including doctor hospital preventive long-term care mental health reproductive health care dental vision prescription drug and medical supply costs.The program would be funded by the savings obtained from replacing today‰Ûªs inefficient profit-oriented multiple insurance payers with a single streamlined nonprofit public payer and by modest new taxes based on ability to pay. Premiums would disappear; **95 percent of all households would save money.** Patients would no longer face financial barriers to care such as co-pays and deductibles and would regain free choice of doctor and hospital. Doctors would regain autonomy over patient care. [source](http://www.pnhp.org/facts/what-is-single-payer),
We're definitely on the same page here.  Absolutely.  And for the love of god can we get some preventative/educational healthcare so we start preventing problems instead of endlessly treating them??  I actually think if the government was footing the bill for the health of their citizens there would suddenly come about a new push in that direction. Sad thing is that I actually think the lifestyle changes would be even harder to sell than single-payer.  If there's one thing we know it's that the American people don't like to hear that they're responsible for something or have to do hard work to gain something.  I mean we like to say that sort of thing to other people to motivate them but we sure don't like it coming in our direction!,
"Lol. Well there's the issue. That's not the bill by the way. That's just an image of some text.The bill is a companion bill to the House bill H.R.676 which makes it illegal to duplicate coverage but allows for supplemental private insurance. This is common in many countries with a universal public health insurance system (and also common with **our** public health insurance system Medicare supplements are a thing).So like I said... You're wrong.EDIT: You've added the Vox article... Which I guess is still better than that ridiculous image. It's still just a poorly worded ""summary"" and not actual legislation ... It also still says *in almost all cases*...",
Every form?  Firemen already provide emergency medical services for most Americans...they *literally* provide a large and important piece of US healthcare already and they do an excellent job all on the taxpayer's dime.  You can't just cry foul every time someone blows up your argument.But whatever.  96% of all physicians are already Participating Providers in Medicare.  That means they voluntarily agree to the rates the government pays.  Are 96% of all doctors wage slaves?  Seniors love their Medicare.  How is this immoral and unjust?  It's not.  By the way doctors can opt for balanced billing if they want.  They can take whatever Medicare pays and bill the patient for the rest.  Only 4% do that.  Seems like you're climbing up on a pretty high horse over a fat lot of nothing.,
That's really good to know! Thanks for sharing that. I'm not sure how the math works out but I would assume that that's probably cheaper than the system we have now. All I know is the way it is now it's almost impossible for me to provide insurance to my employees. Every insurance company I talked to wanted me to have ALL my employees take the insurance for them to offer coverage. And some companies just flatly refused to insure us because there wouldn't be enough employees to make it worth their while. I pay all my employees above minimum wage offer shift differentials and pay double time for holidays just to try to stay competitive. Also I give out bonuses to anyone that picks up shifts and for Christmas. So even if I had to pay for part of their health insurance I could adjust those other benefits a bit to help offset the added cost. ,
They would still make that law though so they'd still be setting their own salary. I think the way it is now is fine. I think the problem is we the people are too hard on them when they want to raise the salary because it's more than we make. You want people outside the business/finance world to be attracted to these jobs. They're at $174k right now. That seems like a lot but they have to travel a ton and pay for a mortgage and rent and other extras that come with the job so I still think it's too low.,
Because modern weapon systems in aircraft missiles and spacecraft take about 10-15 years to come online.  They can't be welded together by car mechanics like WWII tanks were they have to be designed by the best aerospace engineers and computer integrators in the world nearly a decade ahead of when they're needed.  So unfortunately we have to stay on the cutting edge of technology if we're going to deter peer-states like China and Russia from expanding.  But I totally agree with Jack that we don't need to USE all these weapons all the time in many tiny proxy wars.  We just DO need to develop and train on them years ahead of time because in the next big war air and naval superiority will be decided in a matter of weeks.  ,
"Part of the reason they didn't flee is that the rest of the developed world had taxes which were just as high if not higher. After WWII European nations needed very high tax rates to pay off war debt and to pay for rebuilding efforts (as well as for things like healthcare which were established in the wake of the war). The Beatles song ""Taxman"" is a lament that the highest marginal tax rate in Britain was 95% (""Let me tell you how it will be/it's one for you nineteen for me.""). This rate was significantly rolled back under Thatcher. France did institute a wealth tax a few years ago and it did drive several billionaires out of the country. There are limits to what people will tolerate *if they have other options.*  The rich in the US had no better options in the 50s 60s and 70s but with the rise of multinational corporations the internet lowered tax rates in developed countries and developing countries that are much more developed than they were 40 years ago there are a lot more viable options for people to move to for tax avoidance. There is still ample room to raise taxes on the rich but we shouldn't naively think that we can set rates as high as we want. ",
Not actually that easy because the economy functions on numbers magnitudes higher than that and is very complex. Bigger numbers than that are invested every second in this nation often by individuals on everything from pharmaceutical research to the food you eat. Let's not even get into the myriad of ways to hide wealth. This is an unworkable idea on its face. Who will administer this how will they enforce it how will the wealth be redistributed how much wealth will move overseas how much will never be created due to disincentive? 'Easy' plans are usually easy because they ignore reality completely for the sake of sounding good. This is one of those plans. ,
In what way is it dishonest? I‰Ûªm not pretending it‰Ûªs a perfect analogy. I said it‰Ûªs a _callback to_. Does it seem like we‰Ûªre in the 14th century? Of course not. But drawing comparisons to systems distinct in character can reveal similarities in _function_. The analogous part is that people are attached to and dependent on their employer. Go outside the major cities into flyover country. Entire towns are dependent on a single company. The only way you leave that town is through that company. They provide your health insurance policy. Even in major cities you see this where housing incentives provided by large institutions (or rentals from property they own) are effectively the only way to obtain a home at a remotely reasonable price. Can you leave if you want to? Sure. But the average person in such a situation can‰Ûªt just up and leave without unduly endangering themselves and their family (both in health and in financial well-being). https://en.wikipedia.org/wiki/Job_lock,
Eh?I don't think you got the point.If you're for not having a competitive minimum wage because it's ultimately bad for some reasons then how low exactly do you need to keep a person's wages so they and the system don't get hurt by... Making too much money?People on an hourly wage have a fixed income. How can they ever prosper of they don't make money above what they get to provide for basic needs?If all they're afforded is a life of work eat sleep and work again because they're wages aren't high enough how can they ever move forward?,
> Who said anything about destroying progress?That's a rather stupid comment...suggest that I'm saying the person above is arguing to purposely destroy the progress. Did you guys not read the post higher above? https://www.reddit.com/r/politics/comments/6zuvbz/bernie_sanders_unveils_universal_healthcare_bill/dmyc2u3/Bernie's proposal (from 2016) is just setting up for a major destruction. Why the hell would you push for a program that would add $18trillion+ in debt over 10 years and would require MAJOR tax increases to pay for it? You guys think we live in Europe where people tolerate high taxes but the reality is that this is the US and people are economically much further right. >No one expects this getting anywhere near passing with the current congress. However the winds of change are blowing. People smell blood in the water. Congress has been so stagnant approvals are so low and people are getting pissedWinds of change are blowing? They said the same in 1993 with Hillarycare.  Shit dude you act like the Democratic party has been popular.  Approval ratings are very low...on BOTH sides. This country is polarized now -- the left has gone much further left like you and the right has gone much furthers. ,
>By your own admission people did not know him very well. How is this other people's fault?Bernie not being known six months before primaries to people that have never had reason to know him is a little much. Especially when you don't get the recognition in the news like Hillary did. It took months for any news broadcast stations to take him seriously and when they did everyone knew who he was. He couldn't just e-mail NBC NEWS and tell them to talk about him like Hillary could. The support for Bernie when at peak was insane selling out auditoriums and gathering very large crowds whenever he toured. Hillary did not have these crowds and supporters. >She built that not her husband. She built that because of her husband. She wouldn't have the name she wouldn't have the celebrity status if not for her husband. Her running for senate and won because of her husband (because she sure as shit wouldn't have been a name otherwise). Running (and losing) for president for good reason. Served in the cabinet as a pity and prep her to run for president again. All of these positions were not warranted by any major accomplishment or policy changes she made but on the foundation of her being first lady. She is basically a name known for her husband and not her accomplishments. Like Trump is just a name.>If primary voters didn't know much about him during the primary this is his and his campaign's fault no one else's.People did know about him unfortunately as I stated in my post not six months in advance like some areas (like new york) needed to to vote. Bernie also didn't have the DNC in his pocket like Hillary did. And ultimately she lost the presidency. Who's fault was that? Bernie's? Trumps? Only Hillary. Bernie was the only way to beat Trump honestly and we knew that before the primaries were over. Hillary needs to go away.And I'm sure the American people know enough about Bernie to vote for him in the next election.,
"> ""useless incrementalism"" has expanded coverage to tens of millions of people and help slow the spiraling health care costs over the past 3 decades.Useless incrementalism has staved off effective reform for decades now. Useless incrementalism is the reason why people think that Democrats can't get anything effective done on healthcare. Sacrificing getting something truly useful done for getting something marginally better ""right now"" (TM). Oh and if incrementalism was so effective we wouldn't be having double digit healthcare cost increases year over year continuously.I do understand the policy so stop assuming I don't. Single payer isn't the only option. But Democrats have had fucking forever to work on their shit just like the Republicans. If you don't have something useful to offer they should stop shitting up conversation.Edit: I added a sentence to the end of the first paragraph",
"> How about when Brazile passed debate questions to the Hill camp and did it multiple times.> She denied it for months but after immense public pressure buckled and apologized for it and said it was wrong.> http://www.salon.com/2017/03/20/finally-donna-brazile-apologizes-for-passing-debate-questions-during-clinton-sanders-primary-battles/Two questions both unprompted both completely obvious (water quality at a debate in Flint... really).Also - the Sanders campaign acknowledged that she provided [""guidance"" from time to time to them as well](http://www.latimes.com/nation/politics/trailguide/la-na-trailguide-updates-former-senior-aide-to-bernie-sanders-1476297181-htmlstory.html).> And if the future Interim DNC chair did that who knows what else top DNC officials had done to tip the scales. Or what else Brazile did that went under the radar. Not to mention that HRC didnt come out and denounce it as soon as the debate questions went to her.We know because we have their internal emails.> I also suggest you read the internal email exchanges on the DNC on how they planned to sabotage Bernie's campaign. Specific actions?>Or how they limited polling places in heavy Bernie areas.Proof? Since the DNC doesn't run the primary polling that'd be quite the feat coordinating with the state elected officials both Democratic and Republican to conspire against Sanders.> And thats just the tip of the iceberg.Is it now.",
Last estimate over 40% of Americans are uninsured or under insured.What do you think the wait time for those folks is?   I've had 2 knee replacements.  The wait time is more than 10 days that's just flat a lie.  I had to wait about that long to see my primary.Then it took about 30 days to get the referral to a specialist approved from my insurance.  After I found a specialist that was willing to take my insurance it was over 2 months to be able to get in to see him.  After he looked at my records examined me and determined that yes I indeed need knee replacement.It took six weeks to get approval from my insurance company for the procedure.  After all my pre-surgery stuff was done it was still almost 3 weeks before I got a surgical slot.Before I was officially on the schedule to have the surgery I had to pay my surgeon $1500 up front and the hospital $2200 up front.  This is for each knee by the way not all together.  I'm lucky enough that I had the money I bet the above would be problematic for quite a few people.I had the surgery and had to pay almost $2000 more in various copays and fees.  All of the above doesn't factor in all the office copays and the copays I had to pay for tests and steroid shots the insurance company said I had to try before they would approve the surgery.But sure having to wait for a surgical slot for a few months is way worse than dealing with all of the above.Please don't spread misinformation and lies.,
"Checking if being overweight is within a persons control seems like a minefield of lawsuits waiting to happen for negligible gain. Even just gathering and storing if a person is overweight against their will without violating civic rights would probably be a legislative challenge.It also does not seem to fit with your later description of that system being applied to regions and large companies instead of individuals.There is definitely no such system in Germany and just suggesting something even remotely similar to what you described would probably be political suicide here. I never heard of any neighboring country doing something like that before today either.There was public discussion about making people with ""risky lifestyles"" (smoking dangerous hobbies) pay more for their health insurance a few years ago but that was turned down quickly too.I would still be very interested if you could dig out anything more substantial about this.",
